ORF	Name	Memo
YNL322C	KRE1	Cell wall glycoprotein involved in beta-glucan assembly; serves as a K1 killer toxin membrane receptor
YMR307W	GAS1	Beta-1,3-glucanosyltransferase; required for cell wall assembly and also has a role in transcriptional silencing; localizes to cell surface via a glycosylphosphatidylinositol (GPI) anchor; also found at nuclear periphery; genetic interactions with histone H3 lysine acetyltransferases GCN5 and SAS3 indicate previously unsuspected functions for Gas1 in DNA damage response and cell cycle regulation
YHR101C	BIG1	Integral membrane protein of the endoplasmic reticulum; required for normal content of cell wall beta-1,6-glucan
YNL322C	KRE1	Cell wall glycoprotein involved in beta-glucan assembly; serves as a K1 killer toxin membrane receptor
YMR307W	GAS1	Beta-1,3-glucanosyltransferase; required for cell wall assembly and also has a role in transcriptional silencing; localizes to cell surface via a glycosylphosphatidylinositol (GPI) anchor; also found at nuclear periphery; genetic interactions with histone H3 lysine acetyltransferases GCN5 and SAS3 indicate previously unsuspected functions for Gas1 in DNA damage response and cell cycle regulation
YHR101C	BIG1	Integral membrane protein of the endoplasmic reticulum; required for normal content of cell wall beta-1,6-glucan
YNL322C	KRE1	Cell wall glycoprotein involved in beta-glucan assembly; serves as a K1 killer toxin membrane receptor
YKL046C	DCW1	Putative mannosidase; GPI-anchored membrane protein required for cell wall biosynthesis in bud formation;homologous to Dfg5p
YDR162C	NBP2	Protein involved in the HOG (high osmolarity glycerol) pathway; negatively regulates Hog1p by recruitment of phosphatase Ptc1p to the Pbs2p-Hog1p complex; interacts with Bck1p and down regulates the cell wall integrity pathway; found in the nucleus and cytoplasm; contains an SH3 domain and a Ptc1p binding domain (PBM)
YKL046C	DCW1	Putative mannosidase; GPI-anchored membrane protein required for cell wall biosynthesis in bud formation;homologous to Dfg5p
YNL322C	KRE1	Cell wall glycoprotein involved in beta-glucan assembly; serves as a K1 killer toxin membrane receptor
YDR162C	NBP2	Protein involved in the HOG (high osmolarity glycerol) pathway; negatively regulates Hog1p by recruitment of phosphatase Ptc1p to the Pbs2p-Hog1p complex; interacts with Bck1p and down regulates the cell wall integrity pathway; found in the nucleus and cytoplasm; contains an SH3 domain and a Ptc1p binding domain (PBM)
YAL058W	CNE1	Calnexin; integral membrane ER chaperone involved in folding and quality control of glycoproteins; chaperone activity is inhibited by Mpd1p, with which Cne1p interacts; 24% identical to mammalian calnexin; Ca+ binding not yet shown in yeast
YJL187C	SWE1	Protein kinase that regulates the G2/M transition; negative regulator of the Cdc28p kinase; morphogenesis checkpoint kinase; positive regulator of sphingolipid biosynthesis via Orm2p; phosphorylates a tyrosine residue in the N-terminus of Hsp90 in a cell-cycle associated manner, thus modulating the ability of Hsp90 to chaperone a selected clientele; localizes to the nucleus and to the daughter side of the mother-bud neck; homolog of S. pombe Wee1p; potential Cdc28p substrate
YGL027C	CWH41	Processing alpha glucosidase I; ER type II integral membrane N-glycoprotein involved in assembly of cell wall beta 1,6 glucan and asparagine-linked protein glycosylation; also involved in ER protein quality control and sensing of ER stress
YNL322C	KRE1	Cell wall glycoprotein involved in beta-glucan assembly; serves as a K1 killer toxin membrane receptor
YHR101C	BIG1	Integral membrane protein of the endoplasmic reticulum; required for normal content of cell wall beta-1,6-glucan
YNL243W	SLA2	Adaptor protein that links actin to clathrin and endocytosis; involved in membrane cytoskeleton assembly and cell polarization; present in the actin cortical patch of the emerging bud tip; dimer in vivo
YNL322C	KRE1	Cell wall glycoprotein involved in beta-glucan assembly; serves as a K1 killer toxin membrane receptor
YOR336W	KRE5	Protein required for beta-1,6 glucan biosynthesis; mutations result in aberrant morphology and severe growth defects
YMR200W	ROT1	Molecular chaperone involved in protein folding in ER; mutation causes defects in cell wall synthesis and lysis of autophagic bodies, suppresses tor2 mutations, and is synthetically lethal with kar2-1 and with rot2 mutations; involved in N-linked glycosylation and O-mannosylation; transmembrane helix Ser250 is essential for Rot1p to interact with other membrane components and exert its functional role, avoiding exposure of Ser H-bonding group at lipid-exposed surface
YKL046C	DCW1	Putative mannosidase; GPI-anchored membrane protein required for cell wall biosynthesis in bud formation;homologous to Dfg5p
YNL322C	KRE1	Cell wall glycoprotein involved in beta-glucan assembly; serves as a K1 killer toxin membrane receptor
YHR101C	BIG1	Integral membrane protein of the endoplasmic reticulum; required for normal content of cell wall beta-1,6-glucan
YAL058W	CNE1	Calnexin; integral membrane ER chaperone involved in folding and quality control of glycoproteins; chaperone activity is inhibited by Mpd1p, with which Cne1p interacts; 24% identical to mammalian calnexin; Ca+ binding not yet shown in yeast
YJL187C	SWE1	Protein kinase that regulates the G2/M transition; negative regulator of the Cdc28p kinase; morphogenesis checkpoint kinase; positive regulator of sphingolipid biosynthesis via Orm2p; phosphorylates a tyrosine residue in the N-terminus of Hsp90 in a cell-cycle associated manner, thus modulating the ability of Hsp90 to chaperone a selected clientele; localizes to the nucleus and to the daughter side of the mother-bud neck; homolog of S. pombe Wee1p; potential Cdc28p substrate
YJL187C	SWE1	Protein kinase that regulates the G2/M transition; negative regulator of the Cdc28p kinase; morphogenesis checkpoint kinase; positive regulator of sphingolipid biosynthesis via Orm2p; phosphorylates a tyrosine residue in the N-terminus of Hsp90 in a cell-cycle associated manner, thus modulating the ability of Hsp90 to chaperone a selected clientele; localizes to the nucleus and to the daughter side of the mother-bud neck; homolog of S. pombe Wee1p; potential Cdc28p substrate
YAL058W	CNE1	Calnexin; integral membrane ER chaperone involved in folding and quality control of glycoproteins; chaperone activity is inhibited by Mpd1p, with which Cne1p interacts; 24% identical to mammalian calnexin; Ca+ binding not yet shown in yeast
YJL187C	SWE1	Protein kinase that regulates the G2/M transition; negative regulator of the Cdc28p kinase; morphogenesis checkpoint kinase; positive regulator of sphingolipid biosynthesis via Orm2p; phosphorylates a tyrosine residue in the N-terminus of Hsp90 in a cell-cycle associated manner, thus modulating the ability of Hsp90 to chaperone a selected clientele; localizes to the nucleus and to the daughter side of the mother-bud neck; homolog of S. pombe Wee1p; potential Cdc28p substrate
YGR196C	FYV8	Protein of unknown function; required for survival upon exposure to K1 killer toxin
YAL023C	PMT2	Protein O-mannosyltransferase of the ER membrane; transfers mannose residues from dolichyl phosphate-D-mannose to protein serine/threonine residues; involved in ER quality control; acts in a complex with Pmt1p, can instead interact with Pmt5p; antifungal drug target; PMT2 has a paralog, PMT3, that arose from the whole genome duplication
YLR066W	SPC3	Subunit of signal peptidase complex; complex catalyzes cleavage of N-terminal signal sequences of proteins targeted to the secretory pathway; homologous to mammalian SPC22/23; other members of the complex are Spc1p, Spc2p, and Sec11p
YDR437W	GPI19	Subunit of GPI-GlcNAc transferase involved in synthesis of GlcNAc-PI; N-acetylglucosaminyl phosphatidylinositol (GlcNAc-PI) is the first intermediate in glycosylphosphatidylinositol (GPI) anchor synthesis; shares similarity with mammalian PIG-P
YBL041W	PRE7	Beta 6 subunit of the 20S proteasome
YOR259C	RPT4	ATPase of the 19S regulatory particle of the 26S proteasome; one of six ATPases of the regulatory particle; involved in degradation of ubiquitinated substrates; contributes preferentially to ERAD; required for spindle pole body duplication; mainly nuclear localization
YOR117W	RPT5	ATPase of the 19S regulatory particle of the 26S proteasome; one of six ATPases of the regulatory particle; involved in the degradation of ubiquitinated substrates; recruited to the GAL1-10 promoter region upon induction of transcription; similar to human TBP1
YML124C	TUB3	Alpha-tubulin; associates with beta-tubulin (Tub2p) to form tubulin dimer, which polymerizes to form microtubules; expressed at lower level than Tub1p; TUB3 has a paralog, TUB1, that arose from the whole genome duplication
YLR200W	YKE2	Subunit of the heterohexameric Gim/prefoldin protein complex; involved in the folding of alpha-tubulin, beta-tubulin, and actin; prefoldin complex also localizes to chromatin of actively transcribed genes in the nucleus and facilitates transcriptional elongation
YNL153C	GIM3	Subunit of the heterohexameric cochaperone prefoldin complex; prefoldin binds specifically to cytosolic chaperonin and transfers target proteins to it; prefoldin complex also localizes to chromatin of actively transcribed genes in the nucleus and facilitates transcriptional elongation
YOR144C	ELG1	Subunit of an alternative replication factor C complex; important for DNA replication and genome integrity; suppresses spontaneous DNA damage; involved in homologous recombination-mediated repair and telomere homeostasis; required for PCNA (Pol30p) unloading during DNA replication
YKL113C	RAD27	5' to 3' exonuclease, 5' flap endonuclease; required for Okazaki fragment processing and maturation, for long-patch base-excision repair and large loop repair (LLR), ribonucleotide excision repair; member of the S. pombe RAD2/FEN1 family; relocalizes to the cytosol in response to hypoxia
YDL102W	POL3	Catalytic subunit of DNA polymerase delta; required for chromosomal DNA replication during mitosis and meiosis, intragenic recombination, repair of double strand DNA breaks, and DNA replication during nucleotide excision repair (NER)
YBR063C	__	Putative protein of unknown function; YBR063C is not an essential gene
YDR248C	__	Putative gluconokinase; sequence similarity to bacterial and human gluconokinase; green fluorescent protein (GFP)-fusion protein localizes to the cytoplasm; upregulated by deletion of the RNAP-II associated factor, PAF1
YPR131C	NAT3	Catalytic subunit of the NatB N-terminal acetyltransferase; NatB catalyzes acetylation of the amino-terminal methionine residues of all proteins beginning with Met-Asp or Met-Glu and of some proteins beginning with Met-Asn or Met-Met
YPL023C	MET12	Protein with MTHFR activity in vitro; null mutant has no phenotype and is prototrophic for methionine; MET13 encodes major isozyme of methylenetetrahydrofolate reductase (MTHFR)
YJL143W	TIM17	Essential component of the TIM23 complex; with Tim23p, contributes to the architecture and function of the import channel; may link the import motor to the core Translocase of the Inner Mitochondrial membrane (TIM23 complex)
YER012W	PRE1	Beta 4 subunit of the 20S proteasome; localizes to the nucleus throughout the cell cycle
YBL080C	PET112	Subunit of the trimeric GatFAB AmidoTransferase(AdT) complex; involved in the formation of Q-tRNAQ; mutation is functionally complemented by the bacterial GatB ortholog
YBR139W	ATG42	Vacuolar serine-type carboxypeptidase; involved, along with functional homolog Prc1p, in vacuolar zymogen activation, breakdown of the autophagic body, and autophagosome-dependent protein synthesis; role in phytochelatin synthesis; localizes to the vacuole lumen; expression induced by nitrogen limitation in a GLN3, GAT1-independent manner; N-glycosylated
YOL052C	SPE2	S-adenosylmethionine decarboxylase; required for the biosynthesis of spermidine and spermine; cells lacking Spe2p require spermine or spermidine for growth in the presence of oxygen but not when grown anaerobically
YKL061W	BLI1	Subunit of the BLOC-1 complex involved in endosomal maturation; interacts with Msb3p; green fluorescent protein (GFP)-fusion protein localizes to the endosome
YHL025W	SNF6	Subunit of the SWI/SNF chromatin remodeling complex; involved in transcriptional regulation; functions interdependently in transcriptional activation with Snf2p and Snf5p; relocates to the cytosol under hypoxic conditions
YML097C	VPS9	Guanine nucleotide exchange factor (GEF) and ubiquitin receptor; involved in vesicle-mediated vacuolar transport, including Golgi-endosome trafficking and sorting through the multivesicular body (MVB); stimulates the intrinsic guanine nucleotide exchange activity of Rab family members (Vps21p/Ypt52p/Ypt53p); partially redundant with GEF MUK1; required for localization of the CORVET complex to endosomes; similar to mammalian ras inhibitors; contains a Ub-interacting CUE domain
YMR266W	RSN1	Membrane protein of unknown function; overexpression suppresses NaCl sensitivity of sro7 mutant cells by restoring sodium pump (Ena1p) localization to the plasma membrane
YDR266C	HEL2	RING finger ubiquitin ligase (E3); involved in ubiquitination and degradation of excess histones; interacts with Ubc4p and Rad53p; null mutant sensitive to hydroxyurea (HU); green fluorescent protein (GFP)-fusion protein localizes to the cytoplasm; computational analysis suggests a role as a transcription factor
YPL203W	TPK2	cAMP-dependent protein kinase catalytic subunit; promotes vegetative growth in response to nutrients via the Ras-cAMP signaling pathway; partially redundant with Tpk1p and Tpk3p; localizes to P-bodies during stationary phase; relocalizes to the cytosol in response to hypoxia
YJL061W	NUP82	Linker nucleoporin component of the nuclear pore complex (NPC); also part of the NPC cytoplasmic filaments; contributes to nucleocytoplasmic transport and NPC biogenesis; forms stable associations with three FG-nucleoporins (Nsp1p, Nup159p, and Nup116p); relocalizes to the cytosol in response to hypoxia
YOR096W	RPS7A	Protein component of the small (40S) ribosomal subunit; interacts with Kti11p; deletion causes hypersensitivity to zymocin; homologous to mammalian ribosomal protein S7, no bacterial homolog; RPS7A has a paralog, RPS7B, that arose from the whole genome duplication
YNL066W	SUN4	Cell wall protein related to glucanases; possibly involved in cell wall septation; member of the SUN family; SUN4 has a paralog, SIM1, that arose from the whole genome duplication
YDR052C	DBF4	Regulatory subunit of Cdc7p-Dbf4p kinase complex; required for Cdc7p kinase activity and initiation of DNA replication; phosphorylates the Mcm2-7 family of proteins; cell cycle regulated; relative distribution to the nucleus increases upon DNA replication stress; co-expression of human CDC7 and DBF4 complements single cdc7 or dbf4 null mutations or the cdc7 dbf4 double null mutation
YGL141W	HUL5	Multiubiquitin chain assembly factor (E4); proteasome processivity factor that elongates polyUb chains on substrates, opposing Ubp6p, a branched polyubiquitin protease; required for retrograde transport of misfolded proteins during ERAD; required for ubiquitination of a subset of cytosolic misfolded proteins upon heat shock
YOL055C	THI20	Trifunctional enzyme of thiamine biosynthesis, degradation and salvage; has hydroxymethylpyrimidine (HMP) kinase, HMP-phosphate (HMP-P) kinase and thiaminase activities; member of a gene family with THI21 and THI22; HMP and HMP-P kinase activity redundant with Thi21p
YFR040W	SAP155	Protein required for function of the Sit4p protein phosphatase; forms a complex with Sit4p; member of a family of similar proteins including Sap4p, Sap185p, and Sap190p; protein abundance increases in response to DNA replication stress; SAP155 has a paralog, SAP4, that arose from the whole genome duplication
YML082W	__	Putative protein predicted to have carbon-sulfur lyase activity; transcriptionally regulated by Upc2p via an upstream sterol response element; green fluorescent protein (GFP)-fusion protein localizes to the nucleus and the cytoplasm; not an essential gene; YML082W has a paralog, STR2, that arose from the whole genome duplication
YKR081C	RPF2	Essential protein involved in rRNA maturation and ribosomal assembly; involved in the processing of pre-rRNA and the assembly of the 60S ribosomal subunit; interacts with ribosomal protein L11; localizes predominantly to the nucleolus; constituent of 66S pre-ribosomal particles
YIL139C	REV7	Accessory subunit of DNA polymerase zeta; involved in translesion synthesis during post-replication repair; required for mutagenesis induced by DNA damage; involved in double-strand break repair; forms a complex with Rev3p, Pol31p and Pol32p
YKL114C	APN1	Major apurinic/apyrimidinic endonuclease; 3'-repair diesterase; involved in repair of DNA damage by oxidation and alkylating agents; also functions as a 3'-5' exonuclease to repair 7,8-dihydro-8-oxodeoxyguanosine; genetically interacts with NTG1 to maintain mitochondrial genome integrity
YKL224C	PAU16	Protein of unknown function; member of the seripauperin multigene family encoded mainly in subtelomeric regions; SWAT-GFP and mCherry fusion proteins localize to the vacuole
YNL151C	RPC31	RNA polymerase III subunit C31
YHR097C	__	Putative protein of unknown function; green fluorescent protein (GFP)-fusion protein localizes to the cytoplasm and the nucleus; YHR097C has a paralog, PAL1, that arose from the whole genome duplication
YER162C	RAD4	Protein that recognizes and binds damaged DNA (with Rad23p) during NER; subunit of Nuclear Excision Repair Factor 2 (NEF2); also involved, with Rad23p, in turnover of ubiquitylated proteins; Rad4p-Rad23p heterodimer binds to promoters of DNA damage response genes to repress their transcription in the absence of DNA damage; NER stands for nucleotide excision repair
